<?xml version="1.0" encoding="UTF-8"?>
<!DOCTYPE games SYSTEM "6.dtd">
<games>
    <game score="1-1">
        <teams>
            <home></home>
            <guest></guest>
        </teams>
        <goals>
            <goal>
                <player></player>
                <time></time>
            </goal>
        </goals>
        <suspensions>
            <reds>
                <player></player>
                <player></player>
            </reds>
            <yellows>
                <player></player>
                <player></player>
            </yellows>
        </suspensions>
    </game>
</games>